"categoria","texto","","","","","","","","","","","",""
"tecnología","Una empresa emergente ha desarrollado un dron capaz de plantar mil árboles al día, prometiendo revolucionar la reforestación","","","","","","","","","","","",""
"negocios","Los mercados financieros reaccionan positivamente ante el lanzamiento de una nueva plataforma de comercio electrónico sostenible","","","","","","","","","","","",""
"deportes","Se ha confirmado que la ciudad será la anfitriona de los próximos Juegos Olímpicos, prometiendo instalaciones deportivas de vanguardia","","","","","","","","","","","",""
"entretenimiento","El festival de música ha revelado una alineación sin precedentes de artistas internacionales para su próxima edición","","","","","","","","","","","",""
"biologia","Descubren una nueva especie de anfibio en la selva tropical, cuyas propiedades genéticas podrían contribuir a la medicina regenerativa","","","","","","","","","","","",""
"historia","Arqueólogos han desenterrado una ciudad perdida que proporciona nuevas pistas sobre el comercio en la antigüedad","","","","","","","","","","","",""
"tecnología","Investigadores presentan un avance en nanotecnología que podría aumentar la eficiencia de las células solares","","","","","","","","","","","",""
"negocios","Una conocida cadena de cafeterías anuncia su compromiso con el comercio justo, afectando positivamente a miles de productores","","","","","","","","","","","",""
"deportes","Un nuevo récord ha sido establecido en el campeonato mundial de escalada, destacando la fuerza y la destreza de los competidores","","","","","","","","","","","",""
"entretenimiento","Una nueva serie de televisión basada en un famoso libro de ciencia ficción se ha vuelto viral antes de su lanzamiento","","","","","","","","","","","",""
"biologia","Científicos han creado una vacuna innovadora que protege contra múltiples cepas de virus respiratorios","","","","","","","","","","","",""
"historia","Un manuscrito recién descubierto arroja luz sobre la vida cotidiana en una civilización antigua hasta ahora mal entendida","","","","","","","","","","","",""
"tecnología","La última versión del popular software de diseño gráfico incluye inteligencia artificial para optimizar la creatividad","","","","","","","","","","","",""
"negocios","Un acuerdo internacional abre las puertas a una nueva era de colaboración en la industria de la energía renovable","","","","","","","","","","","",""
"deportes","La liga nacional de baloncesto introduce cambios en las reglas para acelerar el juego y hacerlo más dinámico para los espectadores","","","","","","","","","","","",""
"tecnologia","Las gafas de realidad virtual ahora pueden proyectar hologramas interactivos para la educación a distancia","","","","","","","","","","","",""
"negocios","La cadena de supermercados local amplía su servicio de entrega a domicilio para incluir productos frescos de granjas cercanas","","","","","","","","","","","",""
"deportes","Un nuevo récord ha sido establecido en la natación sincronizada por el equipo nacional en el campeonato mundial","","","","","","","","","","","",""
"entretenimiento","Las gafas de realidad virtual ahora pueden proyectar hologramas interactivos para la educación a distancia.","","","","","","","","","","","",""
"politica","La nueva ley de igualdad de salario por género ha entrado en vigor, buscando cerrar la brecha en el ámbito laboral","","","","","","","","","","","",""
"ciencia","Científicos descubren una nueva especie de planta que puede sobrevivir en condiciones extremas de sequía","","","","","","","","","","","",""
"salud","Una nueva técnica de meditación promete reducir el estrés y mejorar la calidad de vida de sus practicantes","","","","","","","","","","","",""
"cultura","El museo de arte contemporáneo ha inaugurado una exposición interactiva que explora la historia de la música electrónica","","","","","","","","","","","",""
"medio ambiente","Activistas organizan una campaña de reforestación a nivel nacional para combatir el cambio climático","","","","","","","","","","","",""
"literatura","La última novela de ciencia ficción del autor galardonado explora los límites de la conciencia humana","","","","","","","","","","","",""
"gastronomia","El chef estrella presenta un menú innovador que fusiona sabores tradicionales con técnicas modernas de cocina","","","","","","","","","","","",""
"viajes","Un nuevo documental invita a los espectadores a un viaje visual por las maravillas ocultas de la Amazonía","","","","","","","","","","","",""
"tecnologia","El telescopio espacial capta imágenes sorprendentes de una nueva galaxia en formación","","","","","","","","","","","",""
"tecnologia","Se ha anunciado un nuevo avance en la computación cuántica, prometiendo revolucionar el procesamiento de datos a una velocidad inimaginable.","","","","","","","","","","","",""
"negocios","La empresa de tecnología emergente ha duplicado su valor en el mercado tras el lanzamiento de su innovador sistema de inteligencia artificial","","","","","","","","","","","",""
"deportes","La selección nacional ha alcanzado un nuevo triunfo histórico, asegurando su lugar en la final de un campeonato internacional de fútbol","","","","","","","","","","","",""
"entretenimiento","La última película de la saga de ciencia ficción ha batido récords de taquilla en su primer fin de semana de estreno mundial","","","","","","","","","","","",""
"politica","Las recientes elecciones han marcado un cambio significativo en la política exterior del país, con una nueva estrategia de acuerdos internacionales","","","","","","","","","","","",""
"ciencia","Investigadores han descubierto una nueva especie en la selva amazónica que podría contener la clave para combatir ciertas enfermedades","","","","","","","","","","","",""
"salud","Un nuevo estudio revela que la meditación y el ejercicio regular contribuyen a una mejor salud mental y reducción del estrés","","","","","","","","","","","",""
"cultura","El festival cultural anual ha vuelto a reunir a artistas de todo el mundo, mostrando una impresionante diversidad de expresiones artísticas","","","","","","","","","","","",""
"medio ambiente","Activistas medioambientales han lanzado una campaña global para promover el uso de energías renovables y reducir la huella de carbono","","","","","","","","","","","",""
"literatura","El último ganador del premio de novela literaria ha sorprendido con una obra que explora las profundidades de la psique humana","","","","","","","","","","","",""
"gastronomia","El reconocido chef ha fusionado la cocina tradicional con técnicas modernas, creando un menú revolucionario que ya es tendencia en la ciudad","","","","","","","","","","","",""
"viajes","Un nuevo blog de viajes invita a los aventureros a explorar destinos ocultos que ofrecen experiencias auténticas y sostenibles","","","","","","","","","","","",""
"tecnologia","La feria de tecnología de este año ha presentado un prototipo de vehículo autónomo que promete ser el futuro del transporte urbano","","","","","","","","","","","",""
"medio ambiente","Una iniciativa global de reforestación está ganando terreno, con millones de árboles siendo plantados para combatir el cambio climático","","","","","","","","","","","",""
"literatura","Un nuevo movimiento literario está tomando forma, con autores que desdibujan las fronteras entre realidad y ficción en sus narrativas","","","","","","","","","","","",""
"gastronomia","La fusión gastronómica está en auge, con chefs innovadores mezclando sabores de distintas culturas para deleitar los paladares más exigentes","","","","","","","","","","","",""
"viajes","Blogueros de viaje están redescubriendo rutas olvidadas, compartiendo con sus seguidores experiencias únicas en lugares remotos del planeta.","","","","","","","","","","","",""
"tecnologia","Se ha desarrollado una nueva tecnología de baterías sostenibles que podrían duplicar la autonomía de los dispositivos móviles","","","","","","","","","","","",""
"tecnologia","Una startup ha creado un ecosistema de aplicaciones inteligentes que se interconectan para optimizar la vida cotidiana de los usuarios","","","","","","","","","","","",""
"negocios","Un gigante del comercio electrónico anuncia su expansión a nuevos mercados, prometiendo revolucionar la logística a nivel mundial","","","","","","","","","","","",""
"deportes","Un nuevo récord mundial de salto de altura ha sido establecido, marcando un hito histórico en el atletismo internacional","","","","","","","","","","","",""
"entretenimiento","Las plataformas de streaming están produciendo contenido original que está cambiando las reglas del juego en la industria del entretenimiento","","","","","","","","","","","",""
"politica","Reformas políticas sin precedentes están siendo debatidas en el congreso, con potencial de transformar la estructura del gobierno","","","","","","","","","","","",""
"ciencia","Un descubrimiento en la física de partículas podría explicar fenómenos del universo que hasta ahora habían permanecido un misterio","","","","","","","","","","","",""
"salud","Avances en la medicina personalizada están permitiendo tratamientos más efectivos y adaptados a la genética individual de los pacientes","","","","","","","","","","","",""
"cultura","Un festival multicultural celebra la diversidad con exposiciones de arte, música y danza de todas partes del mundo","","","","","","","","","","","",""
"medio ambiente","Esfuerzos para proteger los océanos están dando frutos, con la creación de nuevas áreas marinas protegidas","","","","","","","","","","","",""
"literatura","El premio de poesía contemporánea ha sido otorgado a una voz emergente que captura la esencia de la época actual","","","","","","","","","","","",""
"gastronomia","La tendencia de alimentos orgánicos y de origen local está transformando la industria restaurantera, con un enfoque en la calidad y la sostenibilidad","","","","","","","","","","","",""
"viajes","Una aerolínea anuncia vuelos espaciales turísticos, abriendo la posibilidad de viajar más allá de la atmósfera terrestre","","","","","","","","","","","",""
"tecnologia","Investigadores han creado un sistema de inteligencia artificial que puede diagnosticar enfermedades a través de análisis de imagen avanzados","","","","","","","","","","","",""
